{
  "schema_version": "cpu-prefetch-q15-r-p4-r-c-d104-action-authorization-template/1",
  "template_id": "Q15-R-P4-R-C-D104-ACTION-AUTHORIZATION-TEMPLATE-20260826-01",
  "protocol_version": "2.0.0-pre.2",
  "status": "STILL_UNISSUED_REQUIRES_CLEAN_COMMIT_SIGNATURE_REVIEW_AND_EXACT_APPROVAL",
  "preparation_path": "config/q15/q15-r-p4-r-c-d104-preparation-v1.json",
  "transaction_id": "Q15-R-P4-R-C-D104-XEON-CPU-FETCH-20260826-01",
  "capture_id": "Q15-R-P4-R-XEON-CPU-FETCH-20260825-01",
  "authorization_validity_seconds": 1800,
  "signer_key_fingerprint": "SHA256:bOmXmBSxD0rBKid1AKOXQ25jIUjCOrijbM5sN18qLGM",
  "signature_scheme": "OPENSSH-SSHSIG-ED25519-SHA512-v1",
  "signature_principal": "cpu-prefetch-q15-authorization",
  "signature_namespace": "cpu-prefetch-q15-authorization",
  "clean_implementation_commit": null,
  "executor_sha256": null,
  "issued_at_utc": null,
  "expires_at_utc": null,
  "authorization_sha256": null,
  "detached_signature_sha256": null,
  "pre_execution_review_sha256": null,
  "action_owner_approval": null,
  "authority_boundary": {
    "template_preparation_only": true,
    "key_use_or_signing_authorized": false,
    "stand_access_or_mutation_authorized": false,
    "p4_r_c_or_later_authorized": false
  }
}
